<?xml version="1.0"?>

<hotel xmlns:xsi="http://www.w3.org/2001/XMLSchema-instance"
xsi:noNamespaceSchemaLocation="hotel.xsd">

	<pokoje>
		
		<pokoj nr="1">
			<ilosc_osob>3</ilosc_osob>
			<cena>1500</cena>
			<rodzaj_lozka>duze</rodzaj_lozka>
			<tv>tak</tv>
			<internet>wifi</internet>
		</pokoj>
		<pokoj nr="2">
			<ilosc_osob>1</ilosc_osob>
			<cena>500</cena>
			<rodzaj_lozka>male</rodzaj_lozka>
			<tv>tak</tv>
			<internet>kabel</internet>
		</pokoj>
		<pokoj nr="3">
			<ilosc_osob>4</ilosc_osob>
			<cena>2000</cena>
			<rodzaj_lozka>srednie</rodzaj_lozka>
			<tv>tak</tv>
			<internet>brak</internet>
		</pokoj>
	</pokoje>
	
	<rezerwacje>
		
		<rezerwacja id="1">
			<data_rezerwacji>2012-04-20</data_rezerwacji>
			<data_zameldowania>2012-06-12</data_zameldowania>
			<data_wymeldowania>2012-07-20</data_wymeldowania>
		</rezerwacja>
		
		<rezerwacja id="2">
			<data_rezerwacji>2012-04-18</data_rezerwacji>
			<data_zameldowania>2012-06-21</data_zameldowania>
			<data_wymeldowania>2012-07-21</data_wymeldowania>
		</rezerwacja>
		
		<rezerwacja id="2">
			<data_rezerwacji>2012-02-21</data_rezerwacji>
			<data_zameldowania>2012-05-21</data_zameldowania>
			<data_wymeldowania>2012-07-21</data_wymeldowania>
		</rezerwacja>
		
		<rezerwacja id="3">
			<data_rezerwacji>2012-01-21</data_rezerwacji>
			<data_zameldowania>2012-04-21</data_zameldowania>
			<data_wymeldowania>2012-07-21</data_wymeldowania>
		</rezerwacja>
		
		<rezerwacja id="3">
			<data_rezerwacji>2012-01-21</data_rezerwacji>
			<data_zameldowania>2012-03-21</data_zameldowania>
			<data_wymeldowania>2012-07-21</data_wymeldowania>
		</rezerwacja>
		
	</rezerwacje>
	</hotel>
